{
  "build_id": "hesperia_0.5.3_296581f37553_2026-03-26T11:28:43Z",
  "calibration_profile": "default_v1",
  "execution_flow_version": "e2e_v2",
  "orchestration_mode": "E2E_BATCH",
  "payload": [
    {
      "L1": {
        "ALTITUDE_VARIANCE_GLOBAL": 0.0,
        "ALTITUDE_WEIGHTED_MASS": 1.0,
        "AREA_DOMINANCE_RATIO": 1.0,
        "AREA_SPREAD": 0.083333,
        "ATTRIBUTED_TOKENS": 2,
        "CANONICAL_PIPELINE": "sealed_multiscale_v1",
        "COVERAGE_RATIO": 0.25,
        "DOMINANCE_RATIO": 0.5,
        "FAMILY_ACTIVATION_DENSITY": 0.006944,
        "FAMILY_ENTROPY": 0.693147,
        "FAMILY_HIT_VECTOR_L1": 2.0,
        "FAMILY_HIT_VECTOR_L2": 1.414214,
        "GINI_COEFFICIENT": 0.989583,
        "MAX_FAMILY_HITS": 1,
        "MEAN_ALTITUDE_DOMINANT": 0.5,
        "MEAN_ALTITUDE_GLOBAL": 0.5,
        "NORMALIZED_FAMILY_ENTROPY": 0.1224,
        "PROFILE_MODE_ACTIVE": false,
        "SECONDARY_FAMILY_RATIO": 1.0,
        "SIGNAL_TO_NOISE_RATIO": 1.0,
        "SPARSITY_INDEX": 0.993056,
        "STRUCTURAL_STABILITY_INDEX": 0.4388,
        "TOKEN_REDUNDANCY_RATIO": 0.0,
        "TOTAL_TOKENS": 8,
        "UNIQUE_AREAS_HIT": 1,
        "UNIQUE_FAMILIES_HIT": 2
      },
      "L2": {
        "CANONICAL_PIPELINE": "sealed_multiscale_v1"
      },
      "L3": {
        "CANONICAL_PIPELINE": "sealed_multiscale_v1"
      },
      "L4": {
        "CANONICAL_PIPELINE": "sealed_multiscale_v1"
      },
      "L5": {
        "CANONICAL_PIPELINE": "sealed_multiscale_v1"
      },
      "L6": {
        "CANONICAL_PIPELINE": "sealed_multiscale_v1"
      },
      "L7": {
        "DECISION_STATUS_CODE": 0,
        "OUTPUT_TRUST_TAG": "LOW",
        "SYSTEM_CONFIDENCE_SCORE": 0.0367,
        "TRUST_TIER": 1
      },
      "L8": {
        "CANONICAL_PIPELINE": "sealed_multiscale_v1"
      },
      "L9": {
        "BRAND_WORD_TRUST": "FRAGILE",
        "CANONICAL_PIPELINE": "sealed_multiscale_v1"
      },
      "diagnostics": {
        "calibration_profile_bundle": "v1",
        "calibration_status": {
          "l1_calibration_fallback": null,
          "marker_concept_mass": 2.0,
          "true_absence_of_marker_signal": false,
          "uniform_concept_prior_fallback_used": false
        },
        "canonical_pipeline": "sealed_multiscale_v1",
        "concept_registry_version": "1",
        "consistency_profile": {
          "anomaly_score": 0.0,
          "regime": "canonical_multiscale"
        },
        "interpretability_trace": {
          "marker_concept_sample": [
            {
              "concept_id": "HESP-C0000",
              "concept_index": 0,
              "landing_source": "B0",
              "linked_family": 0,
              "token": "altruism"
            },
            {
              "concept_id": "HESP-C0021",
              "concept_index": 21,
              "landing_source": "B0",
              "linked_family": 21,
              "token": "trust"
            }
          ],
          "n_concept": 288,
          "registry_version": "1",
          "stages": [
            "markers",
            "concept",
            "hex_microcell",
            "family_aggregate",
            "area_aggregate"
          ]
        },
        "interpretation_policy_mode": "STRUCTURE_PLUS_CONTEXT",
        "matrix_bundle_version": "v1",
        "n_concept": 288,
        "pch_bundle_version": "v1",
        "semantic_path_guards": {
          "concept_evidence_required_default": true,
          "note": "Set HESPERIA_CONCEPT_EVIDENCE_GUARD=observe|strict for PO-11/PO-12 (strict excludes Dict-A direct family hits from L1 matches).",
          "semantic_evidence": null
        },
        "text_preprocess": {
          "analysis_text_fingerprint": "2a2df7ae6028e20a9e9a81e2",
          "clinical_role_fold_applied": false,
          "phrase_span_count": 22,
          "policy_mode": "default",
          "preprocess_version": "hesperia_text_prep_v1",
          "token_count": 8
        }
      },
      "domain": "social_cohesion",
      "execution_flow": "sealed_multiscale_v1",
      "id": 1,
      "multiscale_signals": {
        "area_activation_vector": [
          2.0,
          0.0,
          0.0,
          0.0,
          0.0,
          0.0,
          0.0,
          0.0,
          0.0,
          0.0,
          0.0,
          0.0
        ],
        "contradiction_pressure": 0.0,
        "family_activation_vector": [
          1.0,
          0.0,
          0.0,
          0.0,
          0.0,
          0.0,
          0.0,
          0.0,
          0.0,
          0.0,
          0.0,
          0.0,
          0.0,
          0.0,
          0.0,
          0.0,
          0.0,
          0.0,
          0.0,
          0.0,
          0.0,
          1.0,
          0.0,
          0.0,
          0.0,
          0.0,
          0.0,
          0.0,
          0.0,
          0.0,
          0.0,
          0.0,
          0.0,
          0.0,
          0.0,
          0.0,
          0.0,
          0.0,
          0.0,
          0.0,
          0.0,
          0.0,
          0.0,
          0.0,
          0.0,
          0.0,
          0.0,
          0.0,
          0.0,
          0.0,
          0.0,
          0.0,
          0.0,
          0.0,
          0.0,
          0.0,
          0.0,
          0.0,
          0.0,
          0.0,
          0.0,
          0.0,
          0.0,
          0.0,
          0.0,
          0.0,
          0.0,
          0.0,
          0.0,
          0.0,
          0.0,
          0.0,
          0.0,
          0.0,
          0.0,
          0.0,
          0.0,
          0.0,
          0.0,
          0.0,
          0.0,
          0.0,
          0.0,
          0.0,
          0.0,
          0.0,
          0.0,
          0.0,
          0.0,
          0.0,
          0.0,
          0.0,
          0.0,
          0.0,
          0.0,
          0.0,
          0.0,
          0.0,
          0.0,
          0.0,
          0.0,
          0.0,
          0.0,
          0.0,
          0.0,
          0.0,
          0.0,
          0.0,
          0.0,
          0.0,
          0.0,
          0.0,
          0.0,
          0.0,
          0.0,
          0.0,
          0.0,
          0.0,
          0.0,
          0.0,
          0.0,
          0.0,
          0.0,
          0.0,
          0.0,
          0.0,
          0.0,
          0.0,
          0.0,
          0.0,
          0.0,
          0.0,
          0.0,
          0.0,
          0.0,
          0.0,
          0.0,
          0.0,
          0.0,
          0.0,
          0.0,
          0.0,
          0.0,
          0.0,
          0.0,
          0.0,
          0.0,
          0.0,
          0.0,
          0.0,
          0.0,
          0.0,
          0.0,
          0.0,
          0.0,
          0.0,
          0.0,
          0.0,
          0.0,
          0.0,
          0.0,
          0.0,
          0.0,
          0.0,
          0.0,
          0.0,
          0.0,
          0.0,
          0.0,
          0.0,
          0.0,
          0.0,
          0.0,
          0.0,
          0.0,
          0.0,
          0.0,
          0.0,
          0.0,
          0.0,
          0.0,
          0.0,
          0.0,
          0.0,
          0.0,
          0.0,
          0.0,
          0.0,
          0.0,
          0.0,
          0.0,
          0.0,
          0.0,
          0.0,
          0.0,
          0.0,
          0.0,
          0.0,
          0.0,
          0.0,
          0.0,
          0.0,
          0.0,
          0.0,
          0.0,
          0.0,
          0.0,
          0.0,
          0.0,
          0.0,
          0.0,
          0.0,
          0.0,
          0.0,
          0.0,
          0.0,
          0.0,
          0.0,
          0.0,
          0.0,
          0.0,
          0.0,
          0.0,
          0.0,
          0.0,
          0.0,
          0.0,
          0.0,
          0.0,
          0.0,
          0.0,
          0.0,
          0.0,
          0.0,
          0.0,
          0.0,
          0.0,
          0.0,
          0.0,
          0.0,
          0.0,
          0.0,
          0.0,
          0.0,
          0.0,
          0.0,
          0.0,
          0.0,
          0.0,
          0.0,
          0.0,
          0.0,
          0.0,
          0.0,
          0.0,
          0.0,
          0.0,
          0.0,
          0.0,
          0.0,
          0.0,
          0.0,
          0.0,
          0.0,
          0.0,
          0.0,
          0.0,
          0.0,
          0.0,
          0.0,
          0.0,
          0.0,
          0.0,
          0.0,
          0.0,
          0.0,
          0.0,
          0.0,
          0.0,
          0.0,
          0.0,
          0.0,
          0.0,
          0.0,
          0.0,
          0.0,
          0.0,
          0.0
        ],
        "hotspot_map": {
          "sample_values": [
            0.024009,
            0.02707,
            0.030521,
            0.034412,
            0.0388,
            0.043746,
            0.049324,
            0.055613,
            0.0,
            0.0,
            0.0,
            0.0,
            0.0,
            0.0,
            0.0,
            0.0,
            0.0,
            0.0,
            0.0,
            0.0,
            0.0,
            0.0,
            0.0,
            0.0,
            0.0,
            0.0,
            0.0,
            0.0,
            0.0,
            0.0,
            0.0,
            0.0,
            0.0,
            0.0,
            0.0,
            0.0,
            0.0,
            0.0,
            0.0,
            0.0,
            0.0,
            0.0,
            0.0,
            0.0,
            0.0,
            0.0,
            0.0,
            0.0,
            0.0,
            0.0,
            0.0,
            0.0,
            0.0,
            0.0,
            0.0,
            0.0,
            0.0,
            0.0,
            0.0,
            0.0,
            0.0,
            0.0,
            0.0,
            0.0,
            0.0,
            0.0,
            0.0,
            0.0,
            0.0,